{
  "$schema": "https://json-schema.org/draft/2020-12/schema",
  "$id": "https://ltools.dev/schema/ltools-project-v1.json",
  "title": "LTools project catalog entry",
  "description": "Entrada declarativa para descubrir y descargar LTools desde GitHub.",
  "type": "object",
  "required": [
    "$schema", "schema", "id", "name", "repository", "homepage", "releases",
    "latest_release_api", "release_manifest", "license", "integration", "distribution", "platforms", "verification"
  ],
  "properties": {
    "$schema": { "type": "string", "format": "uri" },
    "schema": { "const": "ltools-project-v1" },
    "id": { "const": "ltools" },
    "name": { "const": "LTools" },
    "description": { "type": "string" },
    "repository": { "type": "string", "pattern": "^[^/]+/[^/]+$" },
    "homepage": { "type": "string", "format": "uri" },
    "releases": { "type": "string", "format": "uri" },
    "latest_release_api": { "type": "string", "format": "uri" },
    "release_manifest": { "type": "string", "format": "uri" },
    "license": { "type": "string", "minLength": 1 },
    "integration": {
      "type": "object",
      "required": ["optional", "descriptor", "descriptors", "hosts", "standalone_releases_require_it"],
      "properties": {
        "optional": { "const": true },
        "descriptor": { "const": "ltools-terminal.json" },
        "descriptors": {
          "type": "object",
          "required": ["linux", "windows"],
          "properties": {
            "linux": { "const": "ltools-terminal.json" },
            "windows": { "const": "ltools-terminal-windows.json" }
          },
          "additionalProperties": false
        },
        "hosts": { "const": ["LTerminal", "WinSlim Terminal"] },
        "standalone_releases_require_it": { "const": false }
      },
      "additionalProperties": false
    },
    "distribution": {
      "type": "object",
      "required": ["source", "stable_only", "manifest", "verification", "update_strategy", "keep_previous", "allowed_asset_hosts"],
      "properties": {
        "source": { "const": "github-releases" },
        "stable_only": { "const": true },
        "manifest": { "const": "ltools-release.json" },
        "verification": { "const": "sha256" },
        "update_strategy": { "const": "stage-verify-promote" },
        "keep_previous": { "const": true },
        "allowed_asset_hosts": {
          "const": [
            "github.com",
            "objects.githubusercontent.com",
            "release-assets.githubusercontent.com",
            "github-releases.githubusercontent.com"
          ]
        }
      },
      "additionalProperties": false
    },
    "platforms": {
      "type": "object",
      "required": ["linux", "windows"],
      "properties": {
        "linux": { "$ref": "#/$defs/platform" },
        "windows": { "$ref": "#/$defs/platform" }
      },
      "additionalProperties": false
    },
    "verification": {
      "type": "object",
      "required": ["hash_algorithm", "manifest_required", "signature_supported", "signature"],
      "properties": {
        "hash_algorithm": { "const": "sha256" },
        "manifest_required": { "const": true },
        "signature_supported": { "const": true },
        "signature": {
          "type": "object",
          "required": ["algorithm", "manifest", "detached_signature", "encoding"],
          "properties": {
            "algorithm": { "const": "ed25519" },
            "manifest": { "const": "SHA256SUMS.txt" },
            "detached_signature": { "const": "SHA256SUMS.txt.sig" },
            "encoding": { "const": "base64" }
          },
          "additionalProperties": false
        },
        "additional_signatures": {
          "type": "array",
          "minItems": 1,
          "items": {
            "type": "object",
            "required": ["algorithm", "manifest", "detached_signature", "namespace"],
            "properties": {
              "algorithm": { "const": "openssh-sshsig" },
              "manifest": { "const": "SHA256SUMS.txt" },
              "detached_signature": { "const": "SHA256SUMS.txt.sshsig" },
              "namespace": { "const": "ltools-release" }
            },
            "additionalProperties": false
          }
        }
      },
      "additionalProperties": false
    }
  },
  "$defs": {
    "platform": {
      "type": "object",
      "required": ["artifact_kinds", "preferred_kind", "asset_patterns", "install"],
      "properties": {
        "artifact_kinds": { "type": "array", "minItems": 1, "items": { "type": "string" } },
        "preferred_kind": { "type": "string", "minLength": 1 },
        "asset_patterns": { "type": "object", "minProperties": 1, "additionalProperties": { "type": "string" } },
        "runtime": {
          "type": "object",
          "required": ["appimage_requires_fuse", "appimage_extract_override"],
          "properties": {
            "appimage_requires_fuse": { "type": "boolean" },
            "appimage_extract_override": { "const": "APPIMAGE_EXTRACT_AND_RUN=1" },
            "note": { "type": "string", "minLength": 1 }
          },
          "additionalProperties": false
        },
        "install": {
          "type": "object",
          "required": ["portable", "recommended_directory", "executable", "entrypoint", "gui_entrypoint", "cli_entrypoint", "update_strategy"],
          "properties": {
            "portable": { "const": true },
            "recommended_directory": { "type": "string", "minLength": 1 },
            "executable": { "const": true },
            "entrypoint": { "type": "string", "minLength": 1 },
            "gui_entrypoint": { "type": "string", "minLength": 1 },
            "cli_entrypoint": { "type": "string", "minLength": 1 },
            "update_strategy": { "const": "stage-verify-promote" }
          },
          "additionalProperties": false
        }
      },
      "additionalProperties": false
    }
  },
  "additionalProperties": false
}
